key,en,ja,zh_CN
"<!MissingKey:Uh,  >","Uh,  
what is this feeling?","うっ、  
なんだこの感覚？","呃，
这是什么感觉？"
<!MissingKey:...There’s a force pulling me.  >,"...There’s a force pulling me.  
Feels like an invisible vortex.","……何かに引っ張られている。  
見えない渦に飲み込まれそうだ。","……有股力量，正在拉扯我。
唔，仿佛一个无形的漩涡。"
<!MissingKey:It’s Chimera.  >,"It’s Chimera.  
That bastard is nearby...","チメラだ……  
あの野郎、近くにいるな。","是喀迈拉，
那个混蛋也在这附近……"
<!MissingKey:Sigh...  >,"Sigh...  
I have a really bad feeling about this.  
Let’s hope we don’t run into it.","はぁ……  
嫌な予感しかしない。  
頼むから、もう会いたくないな。","唉，
我总有一种不好的预感。
希望咱们别再碰到它。"
<!MissingKey:Something terrifying is out there.  >,"Something terrifying is out there.  
Wait,  
I smell a faint trace of sulfur.","遠くに、とんでもない何かがいる。  
待てよ……  
硫黄の匂いがかすかにする。","远处有什么不得了的东西存在，
等等，
还有一股很淡的硫磺味。"
